2014,3,245,Kasey Torres,https://secure.spellingbee.com/public/results/2014/round_results/speller/245,"San Angelo Standard-Times, San Angelo, Texas",phaeton,"an open automobile with two cross seats, usually four doors, and a folding top.",http://www.merriam-webster.com/dictionary/phaeton,phaeton,
2014,3,246,Nikhita Pathapati,https://secure.spellingbee.com/public/results/2014/round_results/speller/246,"San Antonio Express-News, San Antonio, Texas",entente,a written or unwritten international understanding usually less formally binding than an alliance.,http://www.merriam-webster.com/dictionary/entente,entente,
2014,3,247,Muriel Cotman,https://secure.spellingbee.com/public/results/2014/round_results/speller/247,"Victoria Advocate, Victoria, Texas",hydrochore,a plant that depends primarily on water for the distribution of its seeds or spores.,http://www.merriam-webster.com/dictionary/hydrochore,hydrochore,
2014,3,248,Anna Turner,https://secure.spellingbee.com/public/results/2014/round_results/speller/248,"BBVA Compass Bank, Waco, Texas",zootechny,"the scientific art of maintaining and improving domestic animals through breeding, genetics, nutrition, and housing.",http://www.merriam-webster.com/dictionary/zootechny,zootechny,
2014,3,249,Manasvi Reddy,https://secure.spellingbee.com/public/results/2014/round_results/speller/249,"Times Record News, Wichita Falls, Texas",quiescently,in a manner marked by inactivity or repose.,http://www.merriam-webster.com/dictionary/quiescently,quiescently,
2014,3,250,Manav Thadani,https://secure.spellingbee.com/public/results/2014/round_results/speller/250,"The Virgin Islands Daily News, St. Thomas, U.S. Virgin Islands",oogenesis,formation and maturation of the egg.,http://www.merriam-webster.com/dictionary/oogenesis,oogenesis,
2014,3,251,Mikayla Hall,https://secure.spellingbee.com/public/results/2014/round_results/speller/251,"Utah Valley Spelling Bee, Orem, Utah",ranunculus,any plant of a large and widely distributed genus of herbs that have simple or variously lobed leaves and mostly yellow flowers.,http://www.merriam-webster.com/dictionary/ranunculus,rununculus,E
2014,3,252,Grange Simpson,https://secure.spellingbee.com/public/results/2014/round_results/speller/252,"Southeast Education Service Center, Price, Utah",cornichon,a sour gherkin usually flavored with tarragon.,http://www.merriam-webster.com/dictionary/cornichon,cornichon,
2014,3,253,Liam Lustberg,https://secure.spellingbee.com/public/results/2014/round_results/speller/253,"Rutland Herald/Barre Times-Argus, Rutland, Vermont",Teutonic,of a more or less German nature : having characteristics that are somewhat German.,http://www.merriam-webster.com/dictionary/Teutonic,tutonic,E
2014,3,254,Nicole Seman,https://secure.spellingbee.com/public/results/2014/round_results/speller/254,"Loudoun County Public Schools, Ashburn, Virginia",Faustian,constantly troubled and tormented by spiritual dissatisfaction or spiritual striving.,http://www.merriam-webster.com/dictionary/Faustian,Faustian,
2014,3,255,Samuel Pereles,https://secure.spellingbee.com/public/results/2014/round_results/speller/255,"The News-Virginian and The Daily Progress, Charlottesville, Virginia",ossificatory,of or involving the process of bone formation.,http://www.merriam-webster.com/dictionary/ossificatory,ossificatory,
2014,3,256,Jacob McDaniel,https://secure.spellingbee.com/public/results/2014/round_results/speller/256,"Big Brothers and Big Sisters, Danville, Virginia",podotheca,the scaly covering of the foot of a bird or reptile.,http://www.merriam-webster.com/dictionary/podotheca,podotheca,
2014,3,257,Brianna Bartley,https://secure.spellingbee.com/public/results/2014/round_results/speller/257,"The Free Lance-Star, Fredericksburg, Virginia",ululant,howling : wailing.,http://www.merriam-webster.com/dictionary/ululant,olullent,E
2014,3,258,Brayden Kelley,https://secure.spellingbee.com/public/results/2014/round_results/speller/258,"Rockingham District Ruritans, Harrisonburg, Virginia",luftmensch,"an impractical contemplative person having no definite trade, business, or income : a dreamer.",http://www.merriam-webster.com/dictionary/luftmensch,luftmench,E
2014,3,259,Jensen Schram,https://secure.spellingbee.com/public/results/2014/round_results/speller/259,"The News & Advance, Lynchburg, Virginia",variscite,a bluish to greenish gem mineral sometimes confused with or substituted for turquoise.,http://www.merriam-webster.com/dictionary/variscite,variscite,
2014,3,260,Ankita Vadiala,https://secure.spellingbee.com/public/results/2014/round_results/speller/260,"Prince William Today, Manassas, Virginia",tamari,a high-quality aged soy sauce prepared with little or no added wheat.,http://www.merriam-webster.com/dictionary/tamari,tamari,
2014,3,262,Jae Canetti,https://secure.spellingbee.com/public/results/2014/round_results/speller/262,"Fairfax County Times, Reston, Virginia",edaphon,the animal and plant life present in soils.,http://www.merriam-webster.com/dictionary/edaphon,edaphon,
2014,3,263,Tejas Muthusamy,https://secure.spellingbee.com/public/results/2014/round_results/speller/263,"Richmond Times-Dispatch, Richmond, Virginia",Brigadoon,"a place that is idyllic, unaffected by time, or remote from reality.",http://www.merriam-webster.com/dictionary/Brigadoon,Brigadoon,
2014,3,264,Shayley Martin,https://secure.spellingbee.com/public/results/2014/round_results/speller/264,"The Roanoke Times, Roanoke, Virginia",canescent,growing whitish or grayish.,http://www.merriam-webster.com/dictionary/canescent,canescent,
2014,3,265,Hadrian Reeves,https://secure.spellingbee.com/public/results/2014/round_results/speller/265,"Tazewell County Fair Association, Tazewell, Virginia",papeterie,writing papers cut to size for use and boxed.,http://www.merriam-webster.com/dictionary/papeterie,pepetreau,E
2014,3,266,Jeffrey Cho,https://secure.spellingbee.com/public/results/2014/round_results/speller/266,"Adult Literacy on the Middle Peninsula, Williamsburg, Virginia",egualmente,evenly — used as a direction in music.,http://www.merriam-webster.com/dictionary/egualmente,egualmente,
2014,3,267,George Estep,https://secure.spellingbee.com/public/results/2014/round_results/speller/267,"Boys & Girls Club of Northern Shenandoah Valley, Winchester, Virginia",keiki,"in Hawaii, a child.",http://www.merriam-webster.com/dictionary/keiki,keiki,
2014,3,269,Elisabeth Ince,https://secure.spellingbee.com/public/results/2014/round_results/speller/269,"Skagit Valley Herald, Mount Vernon, Washington",byssoid,cottony.,http://www.merriam-webster.com/dictionary/byssoid,byssoid,
2014,3,270,Téa Freedman-Susskind,https://secure.spellingbee.com/public/results/2014/round_results/speller/270,"Town Hall Seattle, Seattle, Washington",dulcinea,a sweetheart.,http://www.merriam-webster.com/dictionary/dulcinea,dulcinea,
2014,3,271,Emily Schneider,https://secure.spellingbee.com/public/results/2014/round_results/speller/271,"North Central Washington Collaborative Spelling Bee, Wenatchee, Washington",sorbefacient,"a substance that produces or promotes a taking up by various means (as by capillary, osmotic, solvent, or chemical action).",http://www.merriam-webster.com/dictionary/sorbefacient,sorbefacient,
2014,3,272,Varun Kukkillaya,https://secure.spellingbee.com/public/results/2014/round_results/speller/272,"Charleston Gazette-Mail, Charleston, West Virginia",cantatrice,a woman singer; especially : an opera singer.,http://www.merriam-webster.com/dictionary/cantatrice,cantatrice,
2014,3,273,George Triplett,https://secure.spellingbee.com/public/results/2014/round_results/speller/273,"The Clarksburg Exponent-Telegram, Clarksburg, West Virginia",brasserie,a restaurant that sells beer and food.,http://www.merriam-webster.com/dictionary/brasserie,brasserie,
2014,3,275,Lillian Bischof,https://secure.spellingbee.com/public/results/2014/round_results/speller/275,"The Catholic Spirit, Wheeling, West Virginia",Tachism,"nonrepresentational painting marked especially by thickly textured surfaces and by the use of improvised techniques (as dribbling, splattering, or smearing) to create apparently accidental pictorial effects.",http://www.merriam-webster.com/dictionary/Tachism,Tachism,
2014,3,276,Karelyn Malliet,https://secure.spellingbee.com/public/results/2014/round_results/speller/276,"Wisconsin State Journal, Madison, Wisconsin",rhabdomancy,divination by rods or wands.,http://www.merriam-webster.com/dictionary/rhabdomancy,rhabdomancy,
2014,3,277,Victoria Allen,https://secure.spellingbee.com/public/results/2014/round_results/speller/277,"Wyoming Community Foundation, Laramie, Wyoming",pasilla,a slender long usually dried chili pepper that is blackish brown when dried.,http://www.merriam-webster.com/dictionary/pasilla,pasilla,
2014,3,278,Medha Venigalla,https://secure.spellingbee.com/public/results/2014/round_results/speller/278,"The State Journal-Register, Springfield, Illinois",boniface,"the proprietor of a hotel, nightclub, or restaurant.",http://www.merriam-webster.com/dictionary/boniface,boniface,
2014,3,279,Michael Jones,https://secure.spellingbee.com/public/results/2014/round_results/speller/279,"Overstock.com, Salt Lake City, Utah",Cypriot,"a native or inhabitant of Cyprus, an island in the eastern part of the Mediterranean sea.",http://www.merriam-webster.com/dictionary/Cypriot,Cypriot,
2014,3,280,Akshaj Mishra,https://secure.spellingbee.com/public/results/2014/round_results/speller/280,",",wassail,a beverage historically consumed in England on festive occasions (as at Christmas and Twelfth Night) and made of ale or wine flavored with spices and other ingredients.,http://www.merriam-webster.com/dictionary/wassail,wassail,
2014,3,281,Noah Fitzgerald,https://secure.spellingbee.com/public/results/2014/round_results/speller/281,",",enoki,a small edible mushroom.,http://www.merriam-webster.com/dictionary/enoki,enoki,
2014,5,13,Timothy Lau,https://secure.spellingbee.com/public/results/2014/round_results/speller/13,"Los Angeles Spelling Bee Collaborative, Los Angeles, California",messuage,a dwelling house with the adjacent buildings and the adjoining lands used in connection with the household.,http://www.merriam-webster.com/dictionary/messuage,messuage,
2014,5,20,Neha Konakalla,https://secure.spellingbee.com/public/results/2014/round_results/speller/20,"KPIX-TV & KCBS Radio AM & FM, San Francisco, California",graveolent,having a rank smell.,http://www.merriam-webster.com/dictionary/graveolent,graveolent,
2014,5,34,Lillian Allingham,https://secure.spellingbee.com/public/results/2014/round_results/speller/34,"Delaware Spelling Bee Collaborative, Wilmington, Delaware",rufosity,the quality or state of being any of several colors averaging a strong yellowish pink to moderate orange.,http://www.merriam-webster.com/dictionary/rufosity,rufoscity,E
2014,5,38,Jacob Williamson,https://secure.spellingbee.com/public/results/2014/round_results/speller/38,"The Daily News , Bonita Springs, Florida",euripus,a narrow tract of water where the tide or current flows and reflows with violence.,http://www.merriam-webster.com/dictionary/euripus,euripus,
2014,5,43,Mary Horton,https://secure.spellingbee.com/public/results/2014/round_results/speller/43,"Orlando Sentinel Communications, Orlando, Florida",coaxation,a croaking especially of frogs.,http://www.merriam-webster.com/dictionary/coaxation,coaxation,
2014,5,49,Sumedh Garimella,https://secure.spellingbee.com/public/results/2014/round_results/speller/49,"Georgia Association of Educators, Tucker, Georgia",gelid,extremely cold : icy.,http://www.merriam-webster.com/dictionary/gelid,gelid,
2014,5,55,Christine Alex,https://secure.spellingbee.com/public/results/2014/round_results/speller/55,"Chicago Public Schools, Chicago, Illinois",fustigate,criticize severely.,http://www.merriam-webster.com/dictionary/fustigate,fustigate,
2014,5,57,Meghana Kamineni,https://secure.spellingbee.com/public/results/2014/round_results/speller/57,"Commonwealth Edison, Chicago, Illinois",periplus,a voyage or a trip around something (as an island or coast).,http://www.merriam-webster.com/dictionary/periplus,periplus,
2014,5,58,Alia Abiad,https://secure.spellingbee.com/public/results/2014/round_results/speller/58,"Commonwealth Edison, Chicago, Illinois",concinnate,to place fitly together : arrange in good order.,http://www.merriam-webster.com/dictionary/concinnate,concinnate,
2014,5,60,Lucas Urbanski,https://secure.spellingbee.com/public/results/2014/round_results/speller/60,"Northwest Herald, Crystal Lake, Illinois",cataphora,the use of a grammatical substitute (as a pronoun) that has the same reference as a following word or phrase.,http://www.merriam-webster.com/dictionary/cataphora,cataphora,
2014,5,61,Yasir Hasnain,https://secure.spellingbee.com/public/results/2014/round_results/speller/61,"Macon-Piatt Regional Office of Education, Decatur, Illinois",funambulist,an acrobat who performs feats on a rope extended through the air at some height.,http://www.merriam-webster.com/dictionary/funambulist,funambulist,
2014,5,74,Alekhya Ankaraju,https://secure.spellingbee.com/public/results/2014/round_results/speller/74,"Williams Comfort Air, Carmel, Indiana",miniaceous,of the color of red lead oxide.,http://www.merriam-webster.com/dictionary/miniaceous,mineaceous,E
2014,5,87,Tajaun Gibbison,https://secure.spellingbee.com/public/results/2014/round_results/speller/87,"Jamaica Gleaner, Kingston, Jamaica",swidden,an impermanent agricultural plot produced by cutting back and burning off vegetative cover.,http://www.merriam-webster.com/dictionary/swidden,swidden,
2014,5,90,Vanya Shivashankar,https://secure.spellingbee.com/public/results/2014/round_results/speller/90,"The Olathe News, Olathe, Kansas",elepidote,"lacking small, scurfy scales.",http://www.merriam-webster.com/dictionary/elepidote,elepidote,
2014,5,92,Paul Keaton,https://secure.spellingbee.com/public/results/2014/round_results/speller/92,"Scripps Howard First Amendment Center, Lexington, Kentucky",plausive,manifesting praise or approval.,http://www.merriam-webster.com/dictionary/plausive,plausive,
2014,5,115,Neha Seshadri,https://secure.spellingbee.com/public/results/2014/round_results/speller/115,"The Detroit News, Detroit, Michigan",ardoise,a grayish purple.,http://www.merriam-webster.com/dictionary/ardoise,ardoise,
2014,5,123,Hannah Jackson,https://secure.spellingbee.com/public/results/2014/round_results/speller/123,"Saginaw Valley State University, Saginaw, Michigan",inquinate,"defile, corrupt.",http://www.merriam-webster.com/dictionary/inquinate,incuinate,E
2014,5,127,Mark Kivimaki,https://secure.spellingbee.com/public/results/2014/round_results/speller/127,"Augsburg College, Minneapolis, Minnesota",ebullition,"the act, process, or state of boiling or bubbling up.",http://www.merriam-webster.com/dictionary/ebullition,ebullition,
2014,5,132,Faaris Khan,https://secure.spellingbee.com/public/results/2014/round_results/speller/132,"Columbia Daily Tribune, Columbia, Missouri",amontillado,"a pale, dry sherry.",http://www.merriam-webster.com/dictionary/amontillado,amontillado,
2014,5,135,Jade Samanta,https://secure.spellingbee.com/public/results/2014/round_results/speller/135,"Three Rivers Community College, Poplar Bluff, Missouri",subdolous,"somewhat sly; crafty, cunning, artful.",http://www.merriam-webster.com/dictionary/subdolous,subdilous,E
2014,5,139,Gokul Venkatachalam,https://secure.spellingbee.com/public/results/2014/round_results/speller/139,"St. Louis Post-Dispatch, St. Louis, Missouri",morbilli,measles.,http://www.merriam-webster.com/dictionary/morbilli,morbilli,
2014,5,146,Sanjana Malla,https://secure.spellingbee.com/public/results/2014/round_results/speller/146,"The Record and Herald News, Hackensack, New Jersey",anaglyphy,"the art of carving, chasing, or embossing in relief.",http://www.merriam-webster.com/dictionary/anaglyphy,anaglyphy,
2014,5,152,Lydia Loverin,https://secure.spellingbee.com/public/results/2014/round_results/speller/152,"Times Union, Albany, New York",velutinous,covered with a fine and dense silky down : velvety.,http://www.merriam-webster.com/dictionary/velutinous,volutinous,E
2014,5,154,Sriram Hathwar,https://secure.spellingbee.com/public/results/2014/round_results/speller/154,"Corning Rotary Club, Corning, New York",favus,a tile or flagstone cut into a hexagonal shape to produce a honeycomb pattern (as in a pavement).,http://www.merriam-webster.com/dictionary/favus,favus,
2014,5,159,Sai Vishudhi Chandrasekhar,https://secure.spellingbee.com/public/results/2014/round_results/speller/159,"Daily News, New York, New York",phytophilous,fond of plants : living or feeding on plants.,http://www.merriam-webster.com/dictionary/phytophilous,phytophilous,
2014,5,164,Alaina Kenny,https://secure.spellingbee.com/public/results/2014/round_results/speller/164,"The Post-Standard, Syracuse, New York",organzine,a raw silk yarn formed from two or more twisted strands doubled and twisted in the reverse direction when plied that is used for warp threads in fine fabrics.,http://www.merriam-webster.com/dictionary/organzine,organzine,
2014,5,165,Dylan O'Connor,https://secure.spellingbee.com/public/results/2014/round_results/speller/165,"Watertown Daily Times, Watertown, New York",supernaculum,to the last drop.,http://www.merriam-webster.com/dictionary/supernaculum,supernaculum,
2014,5,183,Harry Harman,https://secure.spellingbee.com/public/results/2014/round_results/speller/183,"Ohio University's Scripps College of Communication, Athens, Ohio",demersal,bottom-dwelling — used of marine organisms (as fishes).,http://www.merriam-webster.com/dictionary/demersal,demercal,E
2014,5,184,Max Danner,https://secure.spellingbee.com/public/results/2014/round_results/speller/184,"Ohio University's Scripps College of Communication, Athens, Ohio",retrorse,bent backward or downward.,http://www.merriam-webster.com/dictionary/retrorse,retrorse,
2014,5,187,Joseph Cusi Delamerced,https://secure.spellingbee.com/public/results/2014/round_results/speller/187,"WCPO, Cincinnati, Ohio",parapraxis,a faulty act (as a slip of the tongue) : blunder.,http://www.merriam-webster.com/dictionary/parapraxis,parapraxis,
2014,5,188,Ashwin Veeramani,https://secure.spellingbee.com/public/results/2014/round_results/speller/188,"Northeast Ohio Media Group, Cleveland, Ohio",daphnean,shy or bashful.,http://www.merriam-webster.com/dictionary/daphnean,daphnean,
2014,5,207,Aparajita Rao,https://secure.spellingbee.com/public/results/2014/round_results/speller/207,"WITF: Public Media for Central Pennsylvania, Harrisburg, Pennsylvania",aristarch,a severe critic.,http://www.merriam-webster.com/dictionary/aristarch,aristarch,
2014,5,226,Benjamin Kulas,https://secure.spellingbee.com/public/results/2014/round_results/speller/226,"Crossings Nashville Action Partnership, Antioch, Tennessee",nitid,"bright, glossy, lustrous.",http://www.merriam-webster.com/dictionary/nitid,nitted,E
2014,5,231,Maria Kaltchenko,https://secure.spellingbee.com/public/results/2014/round_results/speller/231,"The Commercial Appeal, Memphis, Tennessee",pointelle,"an openwork design (as in knitted fabric) typically in the shape of chevrons, or a fabric with this design.",http://www.merriam-webster.com/dictionary/pointelle,pointelle,
2014,5,232,Kate Miller,https://secure.spellingbee.com/public/results/2014/round_results/speller/232,"Abilene Reporter-News, Abilene, Texas",duello,the rules of combat between two persons.,http://www.merriam-webster.com/dictionary/duello,duello,
2014,5,235,Lokesh Nagineni,https://secure.spellingbee.com/public/results/2014/round_results/speller/235,"The Dallas Morning News, Dallas, Texas",frison,waste silk usually taken from the outside of the cocoon.,http://www.merriam-webster.com/dictionary/frison,frison,
2014,5,237,Ansun Sujoe,https://secure.spellingbee.com/public/results/2014/round_results/speller/237,"Texas Christian University, Fort Worth, Texas",laulau,meat and fish (as pork and salmon) wrapped in leaves and baked or steamed.,http://www.merriam-webster.com/dictionary/laulau,laulau,
2014,5,238,Shobha Dasari,https://secure.spellingbee.com/public/results/2014/round_results/speller/238,"Houston Public Media, Houston, Texas",seidel,a large glass for beer.,http://www.merriam-webster.com/dictionary/seidel,seidel,
2014,5,239,Syamantak Payra,https://secure.spellingbee.com/public/results/2014/round_results/speller/239,"Houston Public Media, Houston, Texas",circumforaneous,going about from market to market : wandering from place to place.,http://www.merriam-webster.com/dictionary/circumforaneous,circumferaneous,E
2014,5,247,Muriel Cotman,https://secure.spellingbee.com/public/results/2014/round_results/speller/247,"Victoria Advocate, Victoria, Texas",ensilage,"the process of preparing fodder usually by chopping and storing so as to exclude air by compression in a tight trench, pit, or cylindrical structure.",http://www.merriam-webster.com/dictionary/ensilage,enselage,E
2014,5,255,Samuel Pereles,https://secure.spellingbee.com/public/results/2014/round_results/speller/255,"The News-Virginian and The Daily Progress, Charlottesville, Virginia",plessor,a small hammer with a rubber head used in medical percussion.,http://www.merriam-webster.com/dictionary/plessor,plessor,
2014,5,260,Ankita Vadiala,https://secure.spellingbee.com/public/results/2014/round_results/speller/260,"Prince William Today, Manassas, Virginia",llanero,a cowboy or herdsman in Latin America.,http://www.merriam-webster.com/dictionary/llanero,llanero,
2014,5,262,Jae Canetti,https://secure.spellingbee.com/public/results/2014/round_results/speller/262,"Fairfax County Times, Reston, Virginia",parseval,a nonrigid airship usually having a car suspended beneath a gas envelope.,http://www.merriam-webster.com/dictionary/parseval,parsaval,E
2014,5,263,Tejas Muthusamy,https://secure.spellingbee.com/public/results/2014/round_results/speller/263,"Richmond Times-Dispatch, Richmond, Virginia",commorients,two or more persons perishing at the same time by the same calamity.,http://www.merriam-webster.com/dictionary/commorients,commorients,
2014,5,264,Shayley Martin,https://secure.spellingbee.com/public/results/2014/round_results/speller/264,"The Roanoke Times, Roanoke, Virginia",energumen,a person possessed by or as if by an evil spirit : a demoniac.,http://www.merriam-webster.com/dictionary/energumen,energumen,
2014,5,270,Téa Freedman-Susskind,https://secure.spellingbee.com/public/results/2014/round_results/speller/270,"Town Hall Seattle, Seattle, Washington",Gehenna,a place or state of misery.,http://www.merriam-webster.com/dictionary/Gehenna,Gehenna,
2014,6,13,Timothy Lau,https://secure.spellingbee.com/public/results/2014/round_results/speller/13,"Los Angeles Spelling Bee Collaborative, Los Angeles, California",ibidem,"in the same place — usually used, as in a footnote, to avoid repetition of source data in a reference immediately preceding.",http://www.merriam-webster.com/dictionary/ibidem,ibidem,
2014,6,20,Neha Konakalla,https://secure.spellingbee.com/public/results/2014/round_results/speller/20,"KPIX-TV & KCBS Radio AM & FM, San Francisco, California",glaucescent,developing a slight powdery or waxy coating that gives a frosted appearance and tends to rub off.,http://www.merriam-webster.com/dictionary/glaucescent,glaucescent,
2014,6,38,Jacob Williamson,https://secure.spellingbee.com/public/results/2014/round_results/speller/38,"The Daily News , Bonita Springs, Florida",harlequinade,a plotless comedy : farce.,http://www.merriam-webster.com/dictionary/harlequinade,harlequinade,
2014,6,43,Mary Horton,https://secure.spellingbee.com/public/results/2014/round_results/speller/43,"Orlando Sentinel Communications, Orlando, Florida",leporiform,resembling a rabbit or hare in form.,http://www.merriam-webster.com/dictionary/leporiform,leporiform,
2014,6,49,Sumedh Garimella,https://secure.spellingbee.com/public/results/2014/round_results/speller/49,"Georgia Association of Educators, Tucker, Georgia",vaporetto,"a small steamboat used as a canal bus in Venice, Italy.",http://www.merriam-webster.com/dictionary/vaporetto,vaporetto,
2014,6,55,Christine Alex,https://secure.spellingbee.com/public/results/2014/round_results/speller/55,"Chicago Public Schools, Chicago, Illinois",serictery,the silk-producing gland of a caterpillar or other insect larva.,http://www.merriam-webster.com/dictionary/serictery,serictory,E
2014,6,57,Meghana Kamineni,https://secure.spellingbee.com/public/results/2014/round_results/speller/57,"Commonwealth Edison, Chicago, Illinois",cachinnate,laugh usually loudly or convulsively.,http://www.merriam-webster.com/dictionary/cachinnate,cachinnate,
2014,6,58,Alia Abiad,https://secure.spellingbee.com/public/results/2014/round_results/speller/58,"Commonwealth Edison, Chicago, Illinois",misère,a declaration by which a card player engages to lose every trick.,http://www.merriam-webster.com/dictionary/misère,misère,
2014,6,60,Lucas Urbanski,https://secure.spellingbee.com/public/results/2014/round_results/speller/60,"Northwest Herald, Crystal Lake, Illinois",epixylous,growing on wood.,http://www.merriam-webster.com/dictionary/epixylous,epixylous,
2014,6,61,Yasir Hasnain,https://secure.spellingbee.com/public/results/2014/round_results/speller/61,"Macon-Piatt Regional Office of Education, Decatur, Illinois",hermeneutics,the study of the methodological principles of interpretation and explanation.,http://www.merriam-webster.com/dictionary/hermeneutics,hermeneutics,
2014,6,87,Tajaun Gibbison,https://secure.spellingbee.com/public/results/2014/round_results/speller/87,"Jamaica Gleaner, Kingston, Jamaica",vigneron,a winegrower or viticulturist.,http://www.merriam-webster.com/dictionary/vigneron,vigneron,
2014,6,90,Vanya Shivashankar,https://secure.spellingbee.com/public/results/2014/round_results/speller/90,"The Olathe News, Olathe, Kansas",echinite,a fossil sea urchin.,http://www.merriam-webster.com/dictionary/echinite,echinite,
